{
  "schemaVersion": "1.0.0",
  "tool": "Thisbit",
  "exportedAt": "2026-09-10T13:39:04.807Z",
  "capture": {
    "id": "64f57d211ff2477b93ea037ee5d58b77",
    "createdAt": "2026-09-10T13:39:04.760Z",
    "source": "demo",
    "title": "测试画面",
    "imageFile": "capture-64f57d21.png",
    "width": 1000,
    "height": 640,
    "coordinateSpace": "image-pixels",
    "origin": "top-left",
    "rectangleConvention": "top-left-inclusive-bottom-right-exclusive",
    "screenBounds": null,
    "sha256": "bc666bae97bd091c09dc1541d7bf1eabfe23f93fd41e4f0ebc492e25562d2921",
    "pngBase64": "iVBORw0KGgoAAAANSUhEUgAAA+gAAAKACAYAAAAPc1JnAAAAAXNSR0IArs4c6QAAAARnQU1BAACxjwv8YQUAAAAJcEhZcwAAFiUAABYlAUlSJPAAAGDxSURBVHhe7d3Pq3uLed/7/iXpoJOM80d0HlIKGRSPO+ggE5OJcT1IJ8Y0F64xoZP6NNjYAw/dQLAJrjGmYAjYBIfA5XJCBkna2e14XyRtbS191lqSth6tvR+t9XrDC/vsH9rSkvSc9Uj7+z3/4kWSJEmSJH16/yI/IEmSJEmSPj4LuiRJkiRJDbKgS5IkSZLUIAu6JEmSJEkNsqBLkiRJktQgC7okSZIkSQ2yoEuSJEmS1CALuiRJkiRJDbKgS5IkSZLUIAu6JEmSJEkNsqBLkiRJktQgC7okSZIkSQ2yoEuSJEmS1CALuiRJkiRJDbKgS5IkSZLUIAu6JEmSJEkNsqBLkiRJktQgC7okSZIkSQ2yoEuSJEmS1CALuiRJkiRJDbKgS5IkSZLUIAu6JEmSJEkNsqBLkiRJktQgC7okSZIkSQ2yoEuSJGlD/fPLT7/z1Zfv/fbwT7/50Vdf/ujrl33r5/+cFzLob16+9/UfvPwmP/xpxfX5X3/18q33XL/4+n/6+Z++/NGP/ia+6KO7fIx313HqPtpf94n7c87UZUgfnQVdkiRJG2q8oF9azE6fP3xfLnUXfeevXv4pL3DxzpfZueX12C0vUEz64Nt2XLaP99tb+xcU/vTle7+dv43nnd//UreebkH/8vt/+PIvf+93R772i9Pnf+f3vvHyszu/Prv2/VNf+ztf+fOXL/OTLy8vP/uTmc/94hujy/+dP/n52Zfsvje/Zur63HJ982vyZ0mSJK2x0Tuq3/mrl58eF/Df/uC0dA7eRb62wOdC/DntrsOfvvz0fx3///H67P7/xHL9avJ2zb2Dvjs+r//7Wcvt/rqcvTBwuH3vuz4WdPXuKRf0awt1Lujv+fps+vM/f/nabrGNjw8X3z/4/mgNn1jQv3z57ld2l/OHL9/9++FXHj+eP/f1s5PX6frndu2vw8T1nnrBQZIkaX2NF7TD4j78tfB/fvlNvmO7W1AnltxrPmYRnF7Q9++O5zvdwxci3tNxQd8fv497QWL0osoVky86nDW+/6VOWdALn8+F+/C1f/jyB5NL99zXT1/225I+8Y77pe+79LnjCwuWcUmStN3OF7TzP2Mdy9vrr0/vF9+pxXa/tM8tqx+5CE4s6Pvrvltaz6/f6M+U775uf7suv9s+8ql/Ln14e9/bR94v0vuzoFc+//d//vIHU78u//rxXK7PF/TDsjz1Tvtbv/jG5KJ/6Tpd+txNP1OSJGnVHRe0v3n53mjJvLC8nS3or38ePRfds3dwL1zWwxsv6D/d/9nzv3n56XfOF9nRr+yfLehzLzYM30Hv0PUF/e4/W9/mNmqrWdBLnz+8y31ceIdfu/v/+We/zxb0WO6nm37H+9J1uvS5Xcc/y25JlyRJW+z0K9O7ZfTGd43P3jmf+8viLi+MyzZe0I+L9vlCPvGiwds77a/H5OyfB7ftt3/18q23X3H/zNu66/qCPt/EMZAa9ZQLev4FaJcW8vd+fXb586+/hv76l6zl1+af9x4v6ON3x8+bfsc7f05+7tLt3TX8C+fysiVJktbaYVndvas8taAdFs9v7T73oxv/IrTXZfb8V+IvvAu9WPML+ukd8mu/kj/41fjB178t98ePDz+/dHf+uf/Lfw7dgq7ePeWCngvnsPx8/nNW+/z8O+iHXv8yudcFfrygj98dP+/x76CfOlz3qQVekiRpvU0vaLt31nf/qa7D53b/O7fIDhbH10V18tepP2qJ3Xdc0I+/EXB+3YcvTJwvr/nbADPvoB9/Bf47P3j53sSx++iOx/u+6zF9/0tdsqBXPj/3Z9CHX/P6n1Dbfc3n/xn0qc5fRJAkSVp34wXt9BenDT4382euJ5fxqWXxI99pfvtV/eOv7eeLC9OL++lzg+8bXe/dYr7758Gfux99zQf29lsA9/6a+/j+lzplQb/78+O/ZX3ua4+/6v61e/4W94nF+dL3XfrcXPm3y0uSJK238wXt/D9Fdv658X93e+rjg+8Z/UVxH9TZr67ngn7+Lvl4MZ1Y0PMFiN1t3f+M14V49zUTL14s3eHvDxgu5YcXHsa36VIWdPXOgn7X51/fdY6ldvprdx2+fv/r5J/630HfXY/83A3v5EuSJK2m04K2X87PFs3x8na2jMevth/Kd3IHC/EnLLFnC/rx+sZ/Ru7snfTjbwoc/5b6qT+D/vpn63d/M/zb137gbXv7i/1mfub7fuU97y+pV5tY0PMvTdsvyoO/2C0/N/zL0+Y+n38u/Pi1s9ft9Vfdc6kffm7q50916efMXd+3d+Jffy3/2m2RJElaW+d/g/tU4wX92GEJPH3f6bJyYT82+JXwD+2woH8vru9Zx3fJf/Q3L7/50WFZ3d2+4W8BnL2DPlh+37cM17q2mJ93emFk9BsMeZsm7y+pR0+3oEuSJEmStMYs6JIkSZIkNciCLkmSJElSgyzokiRJkiQ1yIIuSZIkSVKDLOiSJEmSJDXIgi5JkiRJUoMs6JIkSZIkNciCLkmSJElSgyzokiRJkiQ1yIIuSZIkSVKDLOiSJEmSJDXIgi5JkiRJUoMs6JIkSZIkNciCLkmSJElSgyzokiRJkiQ1yIIuSZIkSVKDLOiSJEmSJDXIgi5JkiRJUoMs6JIkSZIkNciCLkmSJElSgyzokiRJkiQ1yIIuSZIkSVKDLOiSJEmSJDXIgi5JkiRJUoMs6JIkSZIkNciCLkmSJElSgyzokiRJkiQ1yIIuSZIkSVKDLOiSJEmSJDXoX/yf/+9/vwAAAACfy4IOAAAADVjQAQAAoAELOgAAADRgQQcAAIAGLOgAAADQgAUdAAAAGrCgAwAAQAMWdAAAAGjAgg4AAAANWNABAACgAQs6AAAANGBBBwAAgAYs6AAAANCABR0AAAAasKADAABAAxZ0AAAAaMCCDgAAAA1Y0AEAAKABCzoAAAA0YEEHAACABizoAAAA0IAFHQAAABqwoAMAAEADFnQAAABowIIOAAAADVjQAQAAoAELOgAAADRgQQcAAIAGLOgAAADQgAUdAAAAGrCgAwAAQAMWdAAAAGjAgg4AAAANWNABAACgAQs6AAAANGBBBwAAgAYs6AAAANCABR0AAAAasKADAABAAxZ0AAAAaMCCDgAAAA1Y0AEAAKABCzoAAAA0YEEHAACABizoAAAA0IAFHQAAABqwoAMAAEADFnQAAABowIIOAAAADaxsQf/1y3/5d//m5b/8bX78f7/8n5/+8cu//L3fffM7vzfzdU9nd5t/9+X3/+uvJz7331/++Ow2//HLX46+5n+//O1//Tcvv/Pv/uzlbyc+9xwOt3Pu9q3V7n47e0z/x/8++pol/OV/PP3Mj/m58The/OcBAMDnWNGCfjqJn1y+F1rQc0l6pOuLyPniMl7Sry/ow+v/qGOytFwQh/74p+OvX6t87F1/vDzG6OdOPK4eKp67H/IzAYA3/+rf/2toLx+3z2odC/rf/tnL749O4M+XzaWWirzcR7q2cE397PPvubygTy26137mZ5i6nnP2vwkwsdBdk8fmGUzd/+9x922eeL4t+cLI1O0cvxgFACwlFyHoKB+3z2odC/rOxFI2XNLzJP/u5STk5T7SbctyLuHDFybyc4PbPPqNgsccjyXcsqCf3e6Jx8I1nW//nOpj73SbD39MIj+/lPcd6/F1e9/3AwBVuQhBR/m4fVbrWdBnFpbjkpufe9Sfuc7LfaSpBf2WZfVRHnWMquZu8+y7thb0m7RZ0O+4v94jf5sGAHifXISgo3zcPqtVLeg7w2VuuODmkveo5TOXpNHycbPxkmRBPzi7T6eWrf2vXE98PH+D4Oz2nB/v+++3z5OPvfeyoAMAt8hFCDrKx+2zWt2C/vY3esdym4ttfv5euSSNlo+bjZekqeuYt2NJ/Rf0Swv4ePE7P56xoOf3PoHRY2/i8XKb8WNvSaPniAUdAFrLRQg6ysfts3ryBf3jFou5k/zRkpTLx83Gt2Vq4TpbVh++VPZcWucX9PHxH/7lYflixvmvxPe8re+Rt33q8XKb8WNv9o8P3CP+UrnRc8SCDgCt5SIEHeXj9llZ0G80d5I/WpJy+bjZ+LZMLVwW9OH9MHHMXj9/9X7JpbHJbX0z8TelP8r4cTU+jqMF/fX6XPrb04/30+hr8ljnfZG/6TDzXLvZoy8PADYuFyHoKB+3z8qCfqPRUvHq6iJ4s/FtGS9SEwv6gxa5wxLTcUE//zX2e/3+f/2zi5czdaw/1YPu1ynvuq0T12Nq4c3nwdvX3vIYevRC/ejLA4CNy0UIOsrH7bOyoN9obvHOxWTu664b35abFqmJBeoeXZeYPL73OCyJ4+M7NHrH+LM96H6dcsvj6tJx/+Of/vrlb4ePlRt/RX32MfbohfrRlwcAG5eLEHSUj9tn9eQL+q3G78JeXcjy13Jn3gm8tMhU3bJI5fUc/XrxJYNFpu8SM77vpvz+vzvcD/tjdna7Ti+Y5J9Jf/uavG8XXI6nTB77Ba/D7OPqys8cHad046K+c/Y4ffRC/ejLA4CNy0UIOsrH7bPaxoJ+zwm7Bb2P1+v53tuW99nUfTV5jK8sqo82eezz8Tf1NTfKFyZGt/nKYn3Pz86feXZ5+Vy65/l5yaMvDwA2Lhch6Cgft89qEwt6LmaHBeH1P8c29yvpeZKfS8XMZT/SaJGa8qBl0hIz8KBjeqvJY/+RC/qFX/+/+psmV41/A2J0mVdeIKiqHDsAwILOc8jH7bPawII+v3xcPIHPBX201BxY0D/Ghx7nBx3TW00e+w9d0MeP90c6vri1ux6TL3Qt+LN3KscOALCg8xzycfus1r+gTy4600v78J29XAgnl5qpr5t7R/6q8XWa+5m3O3/38v7r9vnyOD9S/TgvYMEXCeZu726BPvwxgvFjsWJyKR+yoANAa7kI9fGfX/7Hyz+8/Lf/NPPP3/2fLy//+KOXfxvf92//8h9eRv36Ry//7R/zg6e+/Mv/ED/39v7Hd/N6z/kP++uw+/rddTz/mVyTj9tntfoFffTu4duyMP7V253jn3POhXDuzz/n192/BI+XorlF6nYW9FvUj/MCPmFBPxk/Fiss6ADw3HIRaiMX8N0/v/zPl68Pvubrv96tyMMl/uR8CT4tx5e/7j3mL3PaYEH/T//55b/94/T1Zlo+bp/Vuhf0iRP/sz//OrEEHZeJXAhbLegT1/vR5m7vZ8njPH394r/jPndf3PjHFz7Vgvfx9ds7fixWvHdBLy/Uj748ANi4XIR6OCyzw8V5/874r//z6GsvfXx6QT9frKcW9Ml34Wc6W9D/049evswvuFL+bKbl4/ZZrXhBH79DPrkoDE7mh0tfvvM+vRCOF8fZpfCq8VI0u0gtuLwdzd3ez5LHefr6WdBvUb69k39sZOLrbpX3R7fLA4CNy0Woh/f9mvlbg0W9sqDfZuId9P2Cfv4u/9DuHf/7ftat/vPL/5j4tf81yMfts1rtgp4L9s7ob49+tVv+8nP5/fn54feeLwMzS+FVFvRL8jg/0uxxZpoFHQA2JRehlvaL7/t+JfzuBf2d74JPLej/beod+H/80cvXB+/2z73zXzbxRwHWIB+3z2qVC3ou1+9fwsbLcucFffbr3vNn0GOpubag5+2+9vVV+fMeaf74faL9fTy9WB6PxeQxf70fJz/3+riZeyzfLB9/M9fzZo9eqN9zefm1HR8LAPDJchHqaL/M3vjO8NSvp3/5l7s/833jgl6Rf24+HZfndy7RU7fplh52uxrIx+2zWt2CPrmcX1pMJ+ViO3+Cn4vj+3/W0TMt6Pmr5PPH51HyOE9fv7xeM7f3CZayfBzvr2Pe78Pbd+Fzeewm/6jHe4x+VvH+z/vjgy4vj/HDjg8ArEwuQv0cFurLjZfd+XfQz/82+NGCvnsXfLRk775//A7+1399/rG3d8Un3oU//IzTbTn+be4XF/p7vHP5fxb5uH1WK1rQxwvu0XvfMcwT99lFb2L5eaTZxTEXpLmve8eCnrd5egGeudwPWGjyOE9fv5Us6Hn9Bgtm3k/Dx3Z+7nSMxn8fw3ufE2fy8TezAN8sbu+jTV6/K39MZPrxBQDblItQO/uF8x9e/sev/2Hyb0yfW3JnF/T4dfnRgj51ma8L9+nnvy7aZ7+ifvhz86efcVqS337G/rbsOnzu8X8m3Z9B724dC/qFk+3xIjK/yM+5tIDm4vhIs4tjLkhzX5eL9HBhvbIUjY/bwLvebX+MPM7TP3MNC/r48Xl2/S5d9/zc4HGbx+/sMX3h+bOE0cJ85bFYNfp5cTzeHuuD49DrMQEAnysXoV6Gi/DEu9ivy3u+s70zt6Cffl388rvMw+/f//9f/8+3pXt2qT8u7BPvoB86ff/wn/NnM5aP22f15Av6eJkZml7ixsvKNXOXc89lvcfskvCIBX3iXdXprxsb3uap5WcJn3KcP0Mu2aP74n336emFlvHn3h7XFvTRcWj1mACAT5aLUCeHRXa4xA5+Pf313eipd9WP37tbovf/rfTju8qvi/Nw2d5//e6yZv/Ctt3PPL3jPf91N/wZ9IF/+58e+c75+uXj9lk994J+4cT+4jvA71hIrp2of8ri+JAFffrFjfFCmOJd6gu/XfBIn3KcP9yFJXogf5V9+FjP4zS8baPPHe+7dzwfHmG0MF94Hj/C6OfdcJunjjsAbFUuQm2Mfq386PjnuKffOd97+1Xy4a+Qv/6n297+jPj5r6BPL96DX1sf/uyZJfz0K+unFxLe3i1/+y2A3eVdvhzG8nH7rJ57QX81XFgmT8ZHxotQur6oHoyWnhu/b2y8MNcXx0sL+r3OL/OjFpk8zo9UP84P8tM/e/n9W178eF1oj9f7b/92cB+8Lp7Tt2n8uN8v91eW1UcbPUdHvzVwy3P4ghsvb+4xNXvcAWCjchHq4bAYD3+N/PRr4a8fPy7hseTu3+WOXx0/X5LHf0Z8/GfBjy8CTP8K+uFnxLvpZ3+2/fwvopv+mqmfy5x83D6rVSzoO7uT7emlZFl5kn//EvwkC/pg+ZlbfJaQx7n0wkAucOXj/GiH++3ib4Hcaf88ecTj4JHy/qg+rt5zefm17R4LAPD5chHq4G1xHfxZ7tlFdvjnvSfeBZ9a2Md/M/xhaX5bvKeW6wnDRT3fhT9dVjRxHbkuH7fPajULOgAA8Hi5CEFH+bh9VhZ0AABgVi5C0FE+bp+VBR0AAJiVixB0lI/bZ2VBBwAAZuUiBB3l4/ZZWdABAIBZuQhBR/m4fVYWdAAAYFYuQtBRPm6flQUdAACYlYsQdJSP22dlQQcAAGblIgQd5eP2WVnQAQCAWbkIQUf5uH1WFnQAAGBWLkLQUT5un5UFHQAAmJWLEHSUj9tnZUEHAABm5SIEHeXj9llZ0AEAgFm5CEFH+bh9VhZ0AABgVi5C0FE+bp+VBR0AAJiVixB0lI/bZ2VBBwAAZuUiBB3l4/ZZWdABAIBZuQhBR/m4fVYWdAAAYFYuQtBRPm6flQUdAACYlYsQdJSP22dlQQcAAIAGLOgAAADQgAWdJ/B3L3/x7a++/NG3f/zy5eDjX/7kW6OPAQAAPCsL+tCXP3755te/+vLNn/zd+HNDf/3Fyx99/as3G1/eL1+++Pq3Xv7iy4nLnvm6/TI6cdnX7H525XvH1+k9fvnyxbUFen/Mv3j51f6YfvHyq7OPj6/TNV/89cTPyJ+VHz+zezEg75vh/XX9vtsf7x/+cnB54+t5crw+M1/3w1++/OqHEx9/Vb+PLjlcp/0x3d8/07d7d3vfrscN99vha+8/zpeOx0U//OVjngv5WJ28/rfZ3Zbb78P5y7/lxapLX3P+mJ32duwuHsfDcancR28/c/L5On8MbvG+4/3qwmP/3MxzeMrM/QAAYEEf2J9UfvtbL9+86WSsYHfCtztBm1z0hz/7hpPR42Xlx29w18nqOx2O6YXrNzwJv3Zbdp+/skRcdGV5fDsWeT3O/vn6fXLLsjM2WIZnL2dqqV3W7v47XafdbR+/CDJe0HOpmlE8zucOx+/ex/N7ngtzXzu+v66bu6xp88fk0vI9+rq4D+efo7FwHr/my797/d+4r3f/PHk555d36+2dOp5zi//FF4jervf1x+bc5c86u73j5/CkfNwDAAxY0F8dTlwH7/6880T7PfKk/HwJGpo/IT943wnvmRtOVh/j9SR/7nheuh6TL2DMuXScbvhZZ4Yn2re8K3bhXcO52z0y83OuvqNYM/9O6BUz7+x/8ZP3XMf7jvP4ck7fv+hzYWr5e1sODy9e5OeuPS6njuGb0WNnfh7MLugz1/my4884XzjPXoiZWqCvLp7vuY+OP/t0HY6P1bPvv/bu9uA6XXys57F+PW7j63q4n8cfH17nvJx4bF09TgDAllnQd0Ynee85kXyvfBdyfNJ9OvHNz92yxBwNTwrf832vHnkC+fqO28VlZChPlncecVI7dbI85/hu/f6xMfyevE/G7nuBZ3xy//Y4mF2ybrwtBfli0pSzrzke49nrHMeucJzP3fqcLTwXJh4/x9s+fZ9fvw23HN9bLm92QT8zfoztTdyu6a8fHOPRzLzlOtx6Hw1n8ut1+OHx+X+8/7718s2Jv5di5G1uTBy73e0efP/N8ym93e95vGaO7SNmGQCwWhb010VidNI6WqR37ji5P4p3cd4uN94l3p28XlvQx9c1jE4K4/tGJ4jXPr+g0XU9uPhu1wWnk//33VdXj+mbvE/S6zupryftN92O/dfOXN+3BT2P0e7n5MfuM3kdB4/Xi++a5juKE9f1fUvo8HIvHef0uvx9e3dbLn3ftcf6hc/P3bb9z5y6L67fhvcdm9fH1q1GLxjMzI+J23X6+PAyd7fleB2OX39+nUaXPfHzb72Pzhb04eWezcxLl3O6//7idfkeXc5D59zEdZ06tg//uQDAmmx7QX890Xs7odqfTA1O+GaX92nT76INnZaw42UOT9CP//99C3p+zdRJ4YWl46bP32O4cE6c/L+5vmhef2duytSxmnL+dad30U7LwWjxmTK5kI+Xh/GCe4PB/Xl6vFw/brcaXafB/X/+uYkXrV6fI29L6uixN72EVo/z2OtlDP4Cs/yZw6+bf6xf+PyNt+3k9NycfBHkFqMXQ8aPqdvNPCcmbtcybruPDo+5L15v6+t13r2DHsfkyy//7vxFhLeZGcfw21+8fPHtL17+Ih7nc/fdze+kj2bSxPGdOrajxxwAwMmTLujvOKFPrydGh5OwOHHKBX3v/B3Rod1lDE/Gzhb03UlYfM/hxPPHp5O4s5O308ndhyzoeVzyXf2HnUCeFsmpJeWbP/nx+PoPjd7Fm5